Title	Venue	Year	Authors
Detecting redundant CSS rules in HTML5 applications: a tree rewriting approach.	OOPSLA	2015	["Matthew Hague", "Anthony Widjaja Lin", "C.-H. Luke Ong"]
SATCheck: SAT-directed stateless model checking for SC and TSO.	OOPSLA	2015	["Brian Demsky", "Patrick Lam"]
Programming with enumerable sets of structures.	OOPSLA	2015	["Ivan Kuraj", "Viktor Kuncak", "Daniel Jackson"]
Stateless model checking of event-driven applications.	OOPSLA	2015	["Casper Svenning Jensen", "Anders M\u00f8ller", "Veselin Raychev", "Dimitar Dimitrov", "Martin T. Vechev"]
Synthesis of layout engines from relational constraints.	OOPSLA	2015	["Thibaud Hottelier", "Rastislav Bod\u00edk"]
A sound and optimal incremental build system with dynamic dependencies.	OOPSLA	2015	["Sebastian Erdweg", "Moritz Lichter", "Manuel Weiel"]
FlashMeta: a framework for inductive program synthesis.	OOPSLA	2015	["Oleksandr Polozov", "Sumit Gulwani"]
Scrap your boilerplate with object algebras.	OOPSLA	2015	["Haoyuan Zhang", "Zewei Chu", "Bruno C. d. S. Oliveira", "Tijs van der Storm"]
Conditionally correct superoptimization.	OOPSLA	2015	["Rahul Sharma", "Eric Schkufza", "Berkeley R. Churchill", "Alex Aiken"]
Selective control-flow abstraction via jumping.	OOPSLA	2015	["Sam Blackshear", "Bor-Yuh Evan Chang", "Manu Sridharan"]
Automating grammar comparison.	OOPSLA	2015	["Ravichandhran Madhavan", "Mika\u00ebl Mayer", "Sumit Gulwani", "Viktor Kuncak"]
Reasoning about the POSIX file system: local update and global pathnames.	OOPSLA	2015	["Gian Ntzik", "Philippa Gardner"]
AutoMO: automatic inference of memory order parameters for C/C++11.	OOPSLA	2015	["Peizhao Ou", "Brian Demsky"]
Valor: efficient, software-only region conflict exceptions.	OOPSLA	2015	["Swarnendu Biswas", "Minjia Zhang", "Michael D. Bond", "Brandon Lucia"]
Automatic memory reclamation for lock-free data structures.	OOPSLA	2015	["Nachshon Cohen", "Erez Petrank"]
Protocol-based verification of message-passing parallel programs.	OOPSLA	2015	["Hugo A. L\u00f3pez", "Eduardo R. B. Marques", "Francisco Martins", "Nicholas Ng", "C\u00e9sar Santos", "Vasco Thudichum Vasconcelos", "Nobuko Yoshida"]
Interactively verifying absence of explicit information flows in Android apps.	OOPSLA	2015	["Osbert Bastani", "Saswat Anand", "Alex Aiken"]
ShamDroid: gracefully degrading functionality in the presence of limited resource access.	OOPSLA	2015	["Lucas Brutschy", "Pietro Ferrara", "Omer Tripp", "Marco Pistoia"]
Scalable race detection for Android applications.	OOPSLA	2015	["Pavol Bielik", "Veselin Raychev", "Martin T. Vechev"]
Versatile yet lightweight record-and-replay for Android.	OOPSLA	2015	["Yongjian Hu", "Tanzirul Azim", "Iulian Neamtiu"]
Declarative fence insertion.	OOPSLA	2015	["John Bender", "Mohsen Lesani", "Jens Palsberg"]
Finding deep compiler bugs via guided stochastic program mutation.	OOPSLA	2015	["Vu Le", "Chengnian Sun", "Zhendong Su"]
Vectorization of apply to reduce interpretation overhead of R.	OOPSLA	2015	["Haichuan Wang", "David A. Padua", "Peng Wu"]
Synthesizing Java expressions from free-form queries.	OOPSLA	2015	["Tihomir Gvero", "Viktor Kuncak"]
Accurate profiling in the presence of dynamic compilation.	OOPSLA	2015	["Yudi Zheng", "Lubom\u00edr Bulej", "Walter Binder"]
Fast, multicore-scalable, low-fragmentation memory allocation through large virtual memory and global data structures.	OOPSLA	2015	["Martin Aigner", "Christoph M. Kirsch", "Michael Lippautz", "Ana Sokolova"]
Probability type inference for flexible approximate programming.	OOPSLA	2015	["Brett Boston", "Adrian Sampson", "Dan Grossman", "Luis Ceze"]
Cross-layer memory management for managed language applications.	OOPSLA	2015	["Michael R. Jantz", "Forrest J. Robinson", "Prasad A. Kulkarni", "Kshitij A. Doshi"]
Static analysis of event-driven Node.js JavaScript applications.	OOPSLA	2015	["Magnus Madsen", "Frank Tip", "Ondrej Lhot\u00e1k"]
EXPLORER : query- and demand-driven exploration of interprocedural control flow properties.	OOPSLA	2015	["Yu Feng", "Xinyu Wang", "Isil Dillig", "Calvin Lin"]
Giga-scale exhaustive points-to analysis for Java in under a minute.	OOPSLA	2015	["Jens Dietrich", "Nicholas Hollingum", "Bernhard Scholz"]
Galois transformers and modular abstract interpreters: reusable metatheory for program analysis.	OOPSLA	2015	["David Darais", "Matthew Might", "David Van Horn"]
Learning a strategy for adapting a program analysis via bayesian optimisation.	OOPSLA	2015	["Hakjoo Oh", "Hongseok Yang", "Kwangkeun Yi"]
Runtime pointer disambiguation.	OOPSLA	2015	["P\u00e9ricles Alves", "Fabian Gruber", "Johannes Doerfert", "Alexandros Lamprineas", "Tobias Grosser", "Fabrice Rastello", "Fernando Magno Quint\u00e3o Pereira"]
Performance problems you can fix: a dynamic analysis of memoization opportunities.	OOPSLA	2015	["Luca Della Toffola", "Michael Pradel", "Thomas R. Gross"]
RAIVE: runtime assessment of floating-point instability by vectorization.	OOPSLA	2015	["Wen-Chuan Lee", "Tao Bao", "Yunhui Zheng", "Xiangyu Zhang", "Keval Vora", "Rajiv Gupta"]
Automated backward error analysis for numerical code.	OOPSLA	2015	["Zhoulai Fu", "Zhaojun Bai", "Zhendong Su"]
Using C language extensions for developing embedded software: a case study.	OOPSLA	2015	["Markus Voelter", "Arie van Deursen", "Bernd Kolb", "Stephan Eberle"]
How scale affects structure in Java programs.	OOPSLA	2015	["Cristina V. Lopes", "Joel Ossher"]
Use at your own risk: the Java unsafe API in the wild.	OOPSLA	2015	["Luis Mastrangelo", "Luca Ponzanelli", "Andrea Mocci", "Michele Lanza", "Matthias Hauswirth", "Nathaniel Nystrom"]
Approximate computation with outlier detection in Topaz.	OOPSLA	2015	["Sara Achour", "Martin C. Rinard"]
Remote-scope promotion: clarified, rectified, and verified.	OOPSLA	2015	["John Wickerson", "Mark Batty", "Bradford M. Beckmann", "Alastair F. Donaldson"]
Incremental computation with names.	OOPSLA	2015	["Matthew A. Hammer", "Joshua Dunfield", "Kyle Headley", "Nicholas Labich", "Jeffrey S. Foster", "Michael W. Hicks", "David Van Horn"]
Checks and balances: constraint solving without surprises in object-constraint programming languages.	OOPSLA	2015	["Tim Felgentreff", "Todd D. Millstein", "Alan Borning", "Robert Hirschfeld"]
Optimizing hash-array mapped tries for fast and lean immutable JVM collections.	OOPSLA	2015	["Michael J. Steindorfer", "Jurgen J. Vinju"]
Automating ad hoc data representation transformations.	OOPSLA	2015	["Vlad Ureche", "Aggelos Biboudis", "Yannis Smaragdakis", "Martin Odersky"]
Tracing vs. partial evaluation: comparing meta-compilation approaches for self-optimizing interpreters.	OOPSLA	2015	["Stefan Marr", "St\u00e9phane Ducasse"]
Effectively mapping linguistic abstractions for message-passing concurrency to threads on the Java virtual machine.	OOPSLA	2015	["Ganesha Upadhyaya", "Hridesh Rajan"]
Partial evaluation of machine code.	OOPSLA	2015	["Venkatesh Srinivasan", "Thomas W. Reps"]
A co-contextual formulation of type rules and its application to incremental type checking.	OOPSLA	2015	["Sebastian Erdweg", "Oliver Bracevac", "Edlira Kuci", "Matthias Krebs", "Mira Mezini"]
Disjointness domains for fine-grained aliasing.	OOPSLA	2015	["Stephan Brandauer", "Dave Clarke", "Tobias Wrigstad"]
The chemical approach to typestate-oriented programming.	OOPSLA	2015	["Silvia Crafa", "Luca Padovani"]
Customizable gradual polymorphic effects for Scala.	OOPSLA	2015	["Mat\u00edas Toro", "\u00c9ric Tanter"]
Proceedings of the 2015 ACM SIGPLAN International Conference on Object-Oriented Programming, Systems, Languages, and Applications, OOPSLA 2015, part of SLASH 2015, Pittsburgh, PA, USA, October 25-30, 2015.		2015	["Jonathan Aldrich", "Patrick Eugster"]
Checking correctness of TypeScript interfaces for JavaScript libraries.	OOPSLA	2014	["Asger Feldthaus", "Anders M\u00f8ller"]
Determinacy in static analysis for jQuery.	OOPSLA	2014	["Esben Andreasen", "Anders M\u00f8ller"]
EventBreak: analyzing the responsiveness of user interfaces through performance-guided test generation.	OOPSLA	2014	["Michael Pradel", "Parker Schuh", "George C. Necula", "Koushik Sen"]
Using web corpus statistics for program analysis.	OOPSLA	2014	["Chun-Hung Hsiao", "Michael J. Cafarella", "Satish Narayanasamy"]
Tardis: affordable time-travel debugging in managed runtimes.	OOPSLA	2014	["Earl T. Barr", "Mark Marron"]
Phosphor: illuminating dynamic data flow in commodity jvms.	OOPSLA	2014	["Jonathan Bell", "Gail E. Kaiser"]
Rubah: DSU for Java on a stock JVM.	OOPSLA	2014	["Lu\u00eds Pina", "Lu\u00eds Veiga", "Michael W. Hicks"]
Fast conservative garbage collection.	OOPSLA	2014	["Rifat Shahriyar", "Stephen M. Blackburn", "Kathryn S. McKinley"]
Region-based memory management for GPU programming languages: enabling rich data structures on a spartan host.	OOPSLA	2014	["Eric Holk", "Ryan Newton", "Jeremy G. Siek", "Andrew Lumsdaine"]
Smten with satisfiability-based search.	OOPSLA	2014	["Richard Uhler", "Nirav Dave"]
StreamJIT: a commensal compiler for high-performance stream programming.	OOPSLA	2014	["Jeffrey Bosboom", "Sumanaruban Rajadurai", "Weng-Fai Wong", "Saman P. Amarasinghe"]
SurveyMan: programming and automatically debugging surveys.	OOPSLA	2014	["Emma Tosch", "Emery D. Berger"]
Rate types for stream programs.	OOPSLA	2014	["Thomas Bartenstein", "Yu David Liu"]
Foundations of path-dependent types.	OOPSLA	2014	["Nada Amin", "Tiark Rompf", "Martin Odersky"]
Confined gradual typing.	OOPSLA	2014	["Esteban Allende", "Johan Fabry", "Ronald Garcia", "\u00c9ric Tanter"]
Refactoring Java generics by inferring wildcards, in practice.	OOPSLA	2014	["John Altidor", "Yannis Smaragdakis"]
Continuously measuring critical section pressure with the free-lunch profiler.	OOPSLA	2014	["Florian David", "Ga\u00ebl Thomas", "Julia Lawall", "Gilles Muller"]
Chisel: reliability- and accuracy-aware optimization of approximate computational kernels.	OOPSLA	2014	["Sasa Misailovic", "Michael Carbin", "Sara Achour", "Zichao Qi", "Martin C. Rinard"]
An experimental survey of energy management across the stack.	OOPSLA	2014	["Melanie Kambadur", "Martha A. Kim"]
Understanding energy behaviors of thread management constructs.	OOPSLA	2014	["Gustavo Pinto", "Fernando Castor", "Yu David Liu"]
Distributed REScala: an update algorithm for distributed reactive programming.	OOPSLA	2014	["Joscha Drechsler", "Guido Salvaneschi", "Ragnar Mogk", "Mira Mezini"]
From object algebras to attribute grammars.	OOPSLA	2014	["Tillmann Rendel", "Jonathan Immanuel Brachth\u00e4user", "Klaus Ostermann"]
Late data layout: unifying data representation transformations.	OOPSLA	2014	["Vlad Ureche", "Eugene Burmako", "Martin Odersky"]
i3QL: language-integrated live data views.	OOPSLA	2014	["Ralf Mitschke", "Sebastian Erdweg", "Mirko K\u00f6hler", "Mira Mezini", "Guido Salvaneschi"]
Atlas: leveraging locks for non-volatile memory consistency.	OOPSLA	2014	["Dhruva R. Chakrabarti", "Hans-Juergen Boehm", "Kumud Bhandari"]
Fast splittable pseudorandom number generators.	OOPSLA	2014	["Guy L. Steele Jr.", "Doug Lea", "Christine H. Flood"]
Multithreaded test synthesis for deadlock detection.	OOPSLA	2014	["Malavika Samak", "Murali Krishna Ramanathan"]
Symbolic execution of multithreaded programs from arbitrary program contexts.	OOPSLA	2014	["Tom Bergan", "Dan Grossman", "Luis Ceze"]
CheckCell: data debugging for spreadsheets.	OOPSLA	2014	["Daniel W. Barowy", "Dimitar Gochev", "Emery D. Berger"]
Finding minimum type error sources.	OOPSLA	2014	["Zvonimir Pavlinovic", "Tim King", "Thomas Wies"]
Flint: fixing linearizability violations.	OOPSLA	2014	["Peng Liu", "Omer Tripp", "Xiangyu Zhang"]
Statistical debugging for real-world performance problems.	OOPSLA	2014	["Linhai Song", "Shan Lu"]
Adaptive LL(*) parsing: the power of dynamic analysis.	OOPSLA	2014	["Terence Parr", "Sam Harwell", "Kathleen Fisher"]
Automated migration of build scripts using dynamic analysis and search-based refactoring.	OOPSLA	2014	["Milos Gligoric", "Wolfram Schulte", "Chandra Prasad", "Danny van Velzen", "Iman Narasamdya", "Benjamin Livshits"]
MIX10: compiling MATLAB to X10 for high performance.	OOPSLA	2014	["Vineet Kumar", "Laurie J. Hendren"]
Staged parser combinators for efficient data processing.	OOPSLA	2014	["Manohar Jonnalagedda", "Thierry Coppey", "Sandro Stucki", "Tiark Rompf", "Martin Odersky"]
Bounded exhaustive test input generation from hybrid invariants.	OOPSLA	2014	["Nicol\u00e1s Rosner", "Valeria S. Bengolea", "Pablo Ponzio", "Shadi Abdul Khalek", "Nazareno Aguirre", "Marcelo F. Frias", "Sarfraz Khurshid"]
Compiler verification meets cross-language linking via data abstraction.	OOPSLA	2014	["Peng Wang", "Santiago Cuellar", "Adam Chlipala"]
GPS: navigating weak memory with ghosts, protocols, and separation.	OOPSLA	2014	["Aaron Turon", "Viktor Vafeiadis", "Derek Dreyer"]
Natural proofs for asynchronous programs using almost-synchronous reductions.	OOPSLA	2014	["Ankush Desai", "Pranav Garg", "P. Madhusudan"]
Accelerating iterators in optimizing AST interpreters.	OOPSLA	2014	["Wei Zhang", "Per Larsen", "Stefan Brunthaler", "Michael Franz"]
Call sequence prediction through probabilistic calling automata.	OOPSLA	2014	["Zhijia Zhao", "Bo Wu", "Mingzhou Zhou", "Yufei Ding", "Jianhua Sun", "Xipeng Shen", "Youfeng Wu"]
Space-efficient multi-versioning for input-adaptive feedback-driven program optimizations.	OOPSLA	2014	["Mingzhou Zhou", "Xipeng Shen", "Yaoqing Gao", "Graham Yiu"]
The hiphop virtual machine.	OOPSLA	2014	["Keith Adams", "Jason Evans", "Bertrand Maher", "Guilherme Ottoni", "Andrew Paroski", "Brett Simmers", "Edwin Smith", "Owen Yamauchi"]
Validation of memory accesses through symbolic analyses.	OOPSLA	2014	["Henrique Nazar\u00e9", "Izabela Maffra", "Willer Santos", "Leonardo Barbosa", "Laure Gonnord", "Fernando Magno Quint\u00e3o Pereira"]
Abstract semantic differencing via speculative correlation.	OOPSLA	2014	["Nimrod Partush", "Eran Yahav"]
Efficient subcubic alias analysis for C.	OOPSLA	2014	["Qirun Zhang", "Xiao Xiao", "Charles Zhang", "Hao Yuan", "Zhendong Su"]
Static analysis for independent app developers.	OOPSLA	2014	["Lucas Brutschy", "Pietro Ferrara", "Peter M\u00fcller"]
ASPIRE: exploiting asynchronous parallelism in iterative algorithms using a relaxed consistency based DSM.	OOPSLA	2014	["Keval Vora", "Sai Charan Koduru", "Rajiv Gupta"]
Alembic: automatic locality extraction via migration.	OOPSLA	2014	["Brandon Holt", "Preston Briggs", "Luis Ceze", "Mark Oskin"]
Cybertron: pushing the limit on I/O reduction in data-parallel programs.	OOPSLA	2014	["Tian Xiao", "Zhenyu Guo", "Hucheng Zhou", "Jiaxing Zhang", "Xu Zhao", "Chencheng Ye", "Xi Wang", "Wei Lin", "Wenguang Chen", "Lidong Zhou"]
Translating imperative code to MapReduce.	OOPSLA	2014	["Cosmin Radoi", "Stephen J. Fink", "Rodric M. Rabbah", "Manu Sridharan"]
Proceedings of the 2014 ACM International Conference on Object Oriented Programming Systems Languages & Applications, OOPSLA 2014, part of SPLASH 2014, Portland, OR, USA, October 20-24, 2014.		2014	["Andrew P. Black", "Todd D. Millstein"]
Empirical analysis of programming language adoption.	OOPSLA	2013	["Leo A. Meyerovich", "Ariel S. Rabkin"]
Steering symbolic execution to less traveled paths.	OOPSLA	2013	["You Li", "Zhendong Su", "Linzhang Wang", "Xuandong Li"]
Verifying quantitative reliability for programs that execute on unreliable hardware.	OOPSLA	2013	["Michael Carbin", "Sasa Misailovic", "Martin C. Rinard"]
Efficient context sensitivity for dynamic analyses via calling context uptrees and customized memory management.	OOPSLA	2013	["Jipeng Huang", "Michael D. Bond"]
Miniboxing: improving the speed to code size tradeoff in parametric polymorphism translations.	OOPSLA	2013	["Vlad Ureche", "Cristian Talau", "Martin Odersky"]
Taking off the gloves with reference counting Immix.	OOPSLA	2013	["Rifat Shahriyar", "Stephen M. Blackburn", "Xi Yang", "Kathryn S. McKinley"]
Resurrector: a tunable object lifetime profiling technique for optimizing real-world programs.	OOPSLA	2013	["Guoqing (Harry) Xu"]
CDSchecker: checking concurrent data structures written with C/C++ atomics.	OOPSLA	2013	["Brian Norris", "Brian Demsky"]
Effective race detection for event-driven programs.	OOPSLA	2013	["Veselin Raychev", "Martin T. Vechev", "Manu Sridharan"]
Storage strategies for collections in dynamically typed languages.	OOPSLA	2013	["Carl Friedrich Bolz", "Lukas Diekmann", "Laurence Tratt"]
Instant pickles: generating object-oriented pickler combinators for fast and extensible serialization.	OOPSLA	2013	["Heather Miller", "Philipp Haller", "Eugene Burmako", "Martin Odersky"]
Interacting with dead objects.	OOPSLA	2013	["Robin Salkeld", "Gregor Kiczales"]
Python: the full monty.	OOPSLA	2013	["Joe Gibbs Politz", "Alejandro Martinez", "Matthew Milano", "Sumner Warren", "Daniel Patterson", "Junsong Li", "Anand Chitipothu", "Shriram Krishnamurthi"]
Forsaking inheritance: supercharged delegation in DelphJ.	OOPSLA	2013	["Prodromos Gerakios", "Aggelos Biboudis", "Yannis Smaragdakis"]
Set-based pre-processing for points-to analysis.	OOPSLA	2013	["Yannis Smaragdakis", "George Balatsouras", "George Kastrinis"]
MrCrypt: static analysis for secure cloud computations.	OOPSLA	2013	["Sai Deep Tetali", "Mohsen Lesani", "Rupak Majumdar", "Todd D. Millstein"]
Ironclad C++: a library-augmented type-safe subset of c++.	OOPSLA	2013	["Christian DeLozier", "Richard A. Eisenberg", "Santosh Nagarakatte", "Peter-Michael Osera", "Milo M. K. Martin", "Steve Zdancewic"]
Flexible access control for javascript.	OOPSLA	2013	["Gregor Richards", "Christian Hammer", "Francesco Zappa Nardelli", "Suresh Jagannathan", "Jan Vitek"]
Semi-automatic rename refactoring for JavaScript.	OOPSLA	2013	["Asger Feldthaus", "Anders M\u00f8ller"]
Refactoring with synthesis.	OOPSLA	2013	["Veselin Raychev", "Max Sch\u00e4fer", "Manu Sridharan", "Martin T. Vechev"]
Bottle graphs: visualizing scalability bottlenecks in multi-threaded applications.	OOPSLA	2013	["Kristof Du Bois", "Jennifer B. Sartor", "Stijn Eyerman", "Lieven Eeckhout"]
Ball-Larus path profiling across multiple loop iterations.	OOPSLA	2013	["Daniele Cono D'Elia", "Camil Demetrescu"]
Data-driven equivalence checking.	OOPSLA	2013	["Rahul Sharma", "Eric Schkufza", "Berkeley R. Churchill", "Alex Aiken"]
Synthesis modulo recursive functions.	OOPSLA	2013	["Etienne Kneuss", "Ivan Kuraj", "Viktor Kuncak", "Philippe Suter"]
Code optimizations using formally verified properties.	OOPSLA	2013	["Yao Shi", "Bernard Blackham", "Gernot Heiser"]
Inductive invariant generation via abductive inference.	OOPSLA	2013	["Isil Dillig", "Thomas Dillig", "Boyang Li", "Kenneth L. McMillan"]
Do developers benefit from generic types?: an empirical comparison of generic and raw types in java.	OOPSLA	2013	["Michael Hoppe", "Stefan Hanenberg"]
Option contracts.	OOPSLA	2013	["Christos Dimoulas", "Robert Bruce Findler", "Matthias Felleisen"]
Language support for dynamic, hierarchical data partitioning.	OOPSLA	2013	["Sean Treichler", "Michael Bauer", "Alex Aiken"]
Class hierarchy complementation: soundly completing a partial type graph.	OOPSLA	2013	["George Balatsouras", "Yannis Smaragdakis"]
Multiverse: efficiently supporting distributed high-level speculation.	OOPSLA	2013	["Kaushik Ravichandran", "Santosh Pande"]
Fully concurrent garbage collection of actors on many-core machines.	OOPSLA	2013	["Sylvan Clebsch", "Sophia Drossopoulou"]
Isolation for nested task parallelism.	OOPSLA	2013	["Jisheng Zhao", "Roberto Lublinerman", "Zoran Budimlic", "Swarat Chaudhuri", "Vivek Sarkar"]
Turning nondeterminism into parallelism.	OOPSLA	2013	["Omer Tripp", "Eric Koskinen", "Mooly Sagiv"]
Barrier invariants: a shared state abstraction for the analysis of data-dependent GPU kernels.	OOPSLA	2013	["Nathan Chong", "Alastair F. Donaldson", "Paul H. J. Kelly", "Jeroen Ketema", "Shaz Qadeer"]
Guided GUI testing of android apps with minimal restart and approximate learning.	OOPSLA	2013	["Wontae Choi", "George C. Necula", "Koushik Sen"]
Targeted and depth-first exploration for systematic testing of android apps.	OOPSLA	2013	["Tanzirul Azim", "Iulian Neamtiu"]
The latency, accuracy, and battery (LAB) abstraction: programmer productivity and energy efficiency for continuous mobile context sensing.	OOPSLA	2013	["Aman Kansal", "T. Scott Saponas", "A. J. Bernheim Brush", "Kathryn S. McKinley", "Todd Mytkowicz", "Ryder Ziola"]
Input-covering schedules for multithreaded programs.	OOPSLA	2013	["Tom Bergan", "Luis Ceze", "Dan Grossman"]
OCTET: capturing and controlling cross-thread dependences efficiently.	OOPSLA	2013	["Michael D. Bond", "Milind Kulkarni", "Man Cao", "Minjia Zhang", "Meisam Fathi Salmi", "Swarnendu Biswas", "Aritra Sengupta", "Jipeng Huang"]
Online feedback-directed optimizations for parallel Java code.	OOPSLA	2013	["Albert Noll", "Thomas R. Gross"]
River trail: a path to parallelism in JavaScript.	OOPSLA	2013	["Stephan Herhut", "Richard L. Hudson", "Tatiana Shpeisman", "Jaswanth Sreeram"]
Combining concern input with program analysis for bloat detection.	OOPSLA	2013	["Suparna Bhattacharya", "Kanchi Gopinath", "Mangala Gowri Nanda"]
Injecting mechanical faults to localize developer faults for evolving software.	OOPSLA	2013	["Lingming Zhang", "Lu Zhang", "Sarfraz Khurshid"]
Efficient concurrency-bug detection across inputs.	OOPSLA	2013	["Dongdong Deng", "Wei Zhang", "Shan Lu"]
Detecting API documentation errors.	OOPSLA	2013	["Hao Zhong", "Zhendong Su"]
On-the-fly detection of instability problems in floating-point program execution.	OOPSLA	2013	["Tao Bao", "Xiangyu Zhang"]
Bounded partial-order reduction.	OOPSLA	2013	["Katherine E. Coons", "Madan Musuvathi", "Kathryn S. McKinley"]
On-the-fly capacity planning.	OOPSLA	2013	["Nick Mitchell", "Peter F. Sweeney"]
Relaxed separation logic: a program logic for C11 concurrency.	OOPSLA	2013	["Viktor Vafeiadis", "Chinmay Narayan"]
Proceedings of the 2013 ACM SIGPLAN International Conference on Object Oriented Programming Systems Languages & Applications, OOPSLA 2013, part of SPLASH 2013, Indianapolis, IN, USA, October 26-31, 2013.		2013	["Antony L. Hosking", "Patrick Th. Eugster", "Cristina V. Lopes"]
Type-based safe resource deallocation for shared-memory concurrency.	OOPSLA	2012	["Kohei Suenaga", "Ryota Fukuda", "Atsushi Igarashi"]
Uniqueness and reference immutability for safe parallelism.	OOPSLA	2012	["Colin S. Gordon", "Matthew J. Parkinson", "Jared Parsons", "Aleks Bromfield", "Joe Duffy"]
Safe compiler-driven transaction checkpointing and recovery.	OOPSLA	2012	["Jaswanth Sreeram", "Santosh Pande"]
Towards a practical secure concurrent language.	OOPSLA	2012	["Stefan Muller", "Stephen Chong"]
Predicate abstraction of Java programs with collections.	OOPSLA	2012	["Pavel Parizek", "Ondrej Lhot\u00e1k"]
Reducing the barriers to writing verified specifications.	OOPSLA	2012	["Todd W. Schiller", "Michael D. Ernst"]
GPUVerify: a verifier for GPU kernels.	OOPSLA	2012	["Adam Betts", "Nathan Chong", "Alastair F. Donaldson", "Shaz Qadeer", "Paul Thomson"]
Modular and verified automatic program repair.	OOPSLA	2012	["Francesco Logozzo", "Thomas Ball"]
Mitigating the compiler optimization phase-ordering problem using machine learning.	OOPSLA	2012	["Sameer Kulkarni", "John Cavazos"]
Optimization coaching: optimizers learn to communicate with programmers.	OOPSLA	2012	["Vincent St-Amour", "Sam Tobin-Hochstadt", "Matthias Felleisen"]
Adaptive multi-level compilation in a trace-based Java JIT compiler.	OOPSLA	2012	["Hiroshi Inoue", "Hiroshige Hayashizaki", "Peng Wu", "Toshio Nakatani"]
On the benefits and pitfalls of extending a statically typed language JIT compiler for dynamic scripting languages.	OOPSLA	2012	["Jos\u00e9 G. Casta\u00f1os", "David Edelsohn", "Kazuaki Ishizaki", "Priya Nagpurkar", "Toshio Nakatani", "Takeshi Ogasawara", "Peng Wu"]
An abstract interpretation framework for refactoring with application to extract methods with contracts.	OOPSLA	2012	["Patrick Cousot", "Radhia Cousot", "Francesco Logozzo", "Michael Barnett"]
Refactoring android Java code for on-demand computation offloading.	OOPSLA	2012	["Ying Zhang", "Gang Huang", "Xuanzhe Liu", "Wei Zhang", "Hong Mei", "Shunxiang Yang"]
Kitsune: efficient, general-purpose dynamic software updating for C.	OOPSLA	2012	["Christopher M. Hayden", "Edward K. Smith", "Michail Denchev", "Michael Hicks", "Jeffrey S. Foster"]
Automating object transformations for dynamic software updating.	OOPSLA	2012	["Stephen Magill", "Michael Hicks", "Suriya Subramanian", "Kathryn S. McKinley"]
Exploring multi-threaded Java application performance on multicore hardware.	OOPSLA	2012	["Jennifer B. Sartor", "Lieven Eeckhout"]
Work-stealing without the baggage.	OOPSLA	2012	["Vivek Kumar", "Daniel Frampton", "Stephen M. Blackburn", "David Grove", "Olivier Tardieu"]
Molecule: using monadic and streaming I/O to compose process networks on the JVM.	OOPSLA	2012	["S\u00e9bastien Bocq", "Koen Daenen"]
A black-box approach to understanding concurrency in DaCapo.	OOPSLA	2012	["Tomas Kalibera", "Matthew Mole", "Richard E. Jones", "Jan Vitek"]
Automatically enhancing locality for tree traversals with traversal splicing.	OOPSLA	2012	["Youngjoon Jo", "Milind Kulkarni"]
Elixir: a system for synthesizing concurrent graph programs.	OOPSLA	2012	["Dimitrios Prountzos", "Roman Manevich", "Keshav Pingali"]
From clarity to efficiency for distributed algorithms.	OOPSLA	2012	["Yanhong A. Liu", "Scott D. Stoller", "Bo Lin", "Michael Gorbovitski"]
Program extrapolation with jennisys.	OOPSLA	2012	["K. Rustan M. Leino", "Aleksandar Milicevic"]
Bolt: on-demand infinite loop escape in unmodified binaries.	OOPSLA	2012	["Michael Kling", "Sasa Misailovic", "Michael Carbin", "Martin C. Rinard"]
LEAN: simplifying concurrency bug reproduction via replay-supported execution reduction.	OOPSLA	2012	["Jeff Huang", "Charles Zhang"]
IFRit: interference-free regions for dynamic data-race detection.	OOPSLA	2012	["Laura Effinger-Dean", "Brandon Lucia", "Luis Ceze", "Dan Grossman", "Hans-Juergen Boehm"]
