Title	Venue	Year	Authors
Test complement exclusion: guarantees from dynamic analysis.	ICPC	2015	["Andreas Zeller"]
Concise and consistent naming: ten years later.	ICPC	2015	["Florian Deissenboeck", "Markus Pizka"]
Discovering loners and phantoms in commit and issue data.	ICPC	2015	["Gerald Schermann", "Martin Brandtner", "Sebastiano Panichella", "Philipp Leitner", "Harald C. Gall"]
Detection of software evolution phases based on development activities.	ICPC	2015	["Omar Benomar", "Hani Abdeen", "Houari A. Sahraoui", "Pierre Poulin", "Mohamed Aymen Saied"]
I know what you did last summer: an investigation of how developers spend their time.	ICPC	2015	["Roberto Minelli", "Andrea Mocci", "Michele Lanza"]
RCLinker: automated linking of issue reports and commits leveraging rich contextual information.	ICPC	2015	["Tien-Duy B. Le", "Mario Linares V\u00e1squez", "David Lo", "Denys Poshyvanyk"]
Generating reproducible and replayable bug reports from Android application crashes.	ICPC	2015	["Martin White", "Mario Linares V\u00e1squez", "Peter Johnson", "Carlos Bernal-C\u00e1rdenas", "Denys Poshyvanyk"]
Active semi-supervised defect categorization.	ICPC	2015	["Ferdian Thung", "Xuan-Bach D. Le", "David Lo"]
Could we infer unordered API usage patterns only using the library source code?	ICPC	2015	["Mohamed Aymen Saied", "Hani Abdeen", "Omar Benomar", "Houari A. Sahraoui"]
Searching the state space: a qualitative study of API protocol usability.	ICPC	2015	["Joshua Sunshine", "James D. Herbsleb", "Jonathan Aldrich"]
Synonym suggestion for tags on stack overflow.	ICPC	2015	["Stefanie Beyer", "Martin Pinzger"]
Code, camera, action: how software developers document and share program knowledge using YouTube.	ICPC	2015	["Laura MacLeod", "Margaret-Anne Storey", "Andreas Bergen"]
Generating refactoring proposals to remove clones from automated system tests.	ICPC	2015	["Benedikt Hauptmann", "Elmar J\u00fcrgens", "Volkmar Woinke"]
Framework instantiation using cookbooks constructed with static and dynamic analysis.	ICPC	2015	["Raquel Fialho Lafet\u00e1", "Marcelo de Almeida Maia", "David R\u00f6thlisberger"]
Two user perspectives in program comprehension: end users and developer users.	ICPC	2015	["Tobias Roehm"]
Exploring the use of concern element role information in feature location evaluation.	ICPC	2015	["Emily Hill", "David C. Shepherd", "Lori L. Pollock"]
Rethinking user interfaces for feature location.	ICPC	2015	["Fabian Beck", "Bogdan Dit", "Jaleo Velasco-Madden", "Daniel Weiskopf", "Denys Poshyvanyk"]
Detecting clones in Android applications through analyzing user interfaces.	ICPC	2015	["Charlie Soh", "Hee Beng Kuan Tan", "Yauhen Leanidavich Arnatovich", "Lipo Wang"]
Manually locating features in industrial source code: the search actions of software nomads.	ICPC	2015	["Howell R. Jordan", "Jacek Rosik", "Sebastian Herold", "Goetz Botterweck", "Jim Buckley"]
From obfuscation to comprehension.	ICPC	2015	["Eran Avidan", "Dror G. Feitelson"]
The plague doctor: a promising cure for the window plague.	ICPC	2015	["Roberto Minelli", "Andrea Mocci", "Michele Lanza"]
Polymorphism in the spotlight: studying its prevalence in Java and Smalltalk.	ICPC	2015	["Nevena Milojkovic", "Andrea Caracciolo", "Mircea Filip Lungu", "Oscar Nierstrasz", "David R\u00f6thlisberger", "Romain Robbes"]
A survey of the forms of Java reference names.	ICPC	2015	["Simon Butler", "Michel Wermelinger", "Yijun Yu"]
Make it simple: an empirical analysis of GNU make feature use in open source projects.	ICPC	2015	["Douglas H. Martin", "James R. Cordy", "Bram Adams", "Giuliano Antoniol"]
License usage and changes: a large-scale study of Java projects on GitHub.	ICPC	2015	["Christopher Vendome", "Mario Linares V\u00e1squez", "Gabriele Bavota", "Massimiliano Di Penta", "Daniel M. Germ\u00e1n", "Denys Poshyvanyk"]
Unsupervised software categorization using bytecode.	ICPC	2015	["Javier Escobar-Avila", "Mario Linares V\u00e1squez", "Sonia Haiduc"]
The last line effect.	ICPC	2015	["Moritz Beller", "Andy Zaidman", "Andrey N. Karpov"]
How programmers read regular code: a controlled experiment using eye tracking.	ICPC	2015	["Ahmad Jbara", "Dror G. Feitelson"]
Eye movements in code reading: relaxing the linear order.	ICPC	2015	["Teresa Busjahn", "Roman Bednarik", "Andrew Begel", "Martha E. Crosby", "James H. Paterson", "Carsten Schulte", "Bonita Sharif", "Sascha Tamm"]
Comparing trace visualizations for program comprehension through controlled experiments.	ICPC	2015	["Florian Fittkau", "Santje Finke", "Wilhelm Hasselbring", "Jan Waller"]
Towards visual reflexion models.	ICPC	2015	["Marcello Romanelli", "Andrea Mocci", "Michele Lanza"]
Understanding web applications using component based visual patterns.	ICPC	2015	["Dan C. Cosma", "Petru Florin Mihancea"]
Fault localization during system testing.	ICPC	2015	["Pavan Kumar Chittimalli", "Vipul Shah"]
Recovering workflows from functional tests.	ICPC	2015	["Chetan Khadke", "Sunjit Rana", "Vipul Shah"]
Reordering results of keyword-based code search for supporting simultaneous code changes.	ICPC	2015	["Yusuke Sabi", "Hiroaki Murakami", "Yoshiki Higo", "Shinji Kusumoto"]
VerXCombo: an interactive data visualization of popular library version combinations.	ICPC	2015	["Yuki Yano", "Raula Gaikovina Kula", "Takashi Ishio", "Katsuro Inoue"]
ITMViz: interactive topic modeling for source code analysis.	ICPC	2015	["Amir Saeidi", "Jurriaan Hage", "Ravi Khadka", "Slinger Jansen"]
ExceptionTracer: a solution recommender for exceptions in an integrated development environment.	ICPC	2015	["Vahid Amintabar", "Abbas Heydarnoori", "Mohammad Ghafari"]
Limpio: LIghtweight MPI instrumentatiOn.	ICPC	2015	["Milan Pavlovic", "Milan Radulovic", "Alex Ram\u00edrez", "Petar Radojkovic"]
Proceedings of the 2015 IEEE 23rd International Conference on Program Comprehension, ICPC 2015, Florence/Firenze, Italy, May 16-24, 2015.		2015	["Andrea De Lucia", "Christian Bird", "Rocco Oliveto"]
Innovating in india: designing for constraint, computing for inclusion (keynote).	ICPC	2014	["Edward Cutrell"]
The MoJo family: a story about clustering evaluation (invited talk).	ICPC	2014	["Zhihua Wen", "Vassilios Tzerpos"]
Do architectural design decisions improve the understanding of software architecture? two controlled experiments.	ICPC	2014	["Mojtaba Shahin", "Peng Liang", "Zengyang Li"]
Revealing the relationship between architectural elements and source code characteristics.	ICPC	2014	["Vanius Zapalowski", "Ingrid Nunes", "Daltro Jos\u00e9 Nunes"]
Understanding LDA in source code analysis.	ICPC	2014	["David Binkley", "Daniel Heinz", "Dawn J. Lawrie", "Justin Overfelt"]
A diagnosis-based approach to software comprehension.	ICPC	2014	["Alexandre Perez", "Rui Abreu"]
dsOli: data structure operation location and identification.	ICPC	2014	["David H. White"]
Version history, similar report, and structure: putting them together for improved bug localization.	ICPC	2014	["Shaowei Wang", "David Lo"]
Understanding the database manipulation behavior of programs.	ICPC	2014	["Nesrine Noughi", "Marco Mori", "Loup Meurice", "Anthony Cleve"]
On mapping releases to commits in open source systems.	ICPC	2014	["Joe F. Shobe", "Md Yasser Karim", "Motahareh Bahrami Zanjani", "Huzefa H. Kagdi"]
Ranking crowd knowledge to assist software development.	ICPC	2014	["Lucas Batista Leite de Souza", "Eduardo Cunha Campos", "Marcelo de Almeida Maia"]
How do API changes trigger stack overflow discussions? a study on the Android SDK.	ICPC	2014	["Mario Linares V\u00e1squez", "Gabriele Bavota", "Massimiliano Di Penta", "Rocco Oliveto", "Denys Poshyvanyk"]
Towards more accurate content categorization of API discussions.	ICPC	2014	["Bo Zhou", "Xin Xia", "David Lo", "Cong Tian", "Xinyu Wang"]
CODES: mining source code descriptions from developers discussions.	ICPC	2014	["Carmine Vassallo", "Sebastiano Panichella", "Massimiliano Di Penta", "Gerardo Canfora"]
Condensing class diagrams by analyzing design and network metrics using optimistic classification.	ICPC	2014	["Ferdian Thung", "David Lo", "Mohd Hafeez Osman", "Michel R. V. Chaudron"]
An information visualization feature model for supporting the selection of software visualizations.	ICPC	2014	["Renan Vasconcelos", "Marcelo Schots", "Cl\u00e1udia Werner"]
Enabling integrated development environments with natural user interface interactions.	ICPC	2014	["Denis Delimarschi", "George Swartzendruber", "Huzefa H. Kagdi"]
Amalgamating source code authors, maintainers, and change proneness to triage change requests.	ICPC	2014	["Kamal Hossen", "Huzefa H. Kagdi", "Denys Poshyvanyk"]
Mining unit tests for code recommendation.	ICPC	2014	["Mohammad Ghafari", "Carlo Ghezzi", "Andrea Mocci", "Giordano Tamburrelli"]
Recommending automated extract method refactorings.	ICPC	2014	["Danilo Silva", "Ricardo Terra", "Marco Tulio Valente"]
Identifying and locating interference issues in PHP applications: the case of WordPress.	ICPC	2014	["Laleh Mousavi Eshkevari", "Giuliano Antoniol", "James R. Cordy", "Massimiliano Di Penta"]
Prioritizing maintainability defects based on refactoring recommendations.	ICPC	2014	["Daniela Steidl", "Sebastian Eder"]
How the evolution of emerging collaborations relates to code changes: an empirical study.	ICPC	2014	["Sebastiano Panichella", "Gerardo Canfora", "Massimiliano Di Penta", "Rocco Oliveto"]
On the effect of code regularity on comprehension.	ICPC	2014	["Ahmad Jbara", "Dror G. Feitelson"]
Capturing software traceability links from developers' eye gazes.	ICPC	2014	["Braden Walters", "Timothy Shaffer", "Bonita Sharif", "Huzefa H. Kagdi"]
Comprehension support during knowledge transitions: learning from field.	ICPC	2014	["Vikrant S. Kaulgud", "K. M. Annervaz", "Janardan Misra", "Gary Titus"]
A visualization tool recording historical data of program comprehension tasks.	ICPC	2014	["Katsuhisa Maruyama", "Takayuki Omori", "Shinpei Hayashi"]
An empirical comparison of static and dynamic type systems on API usage in the presence of an IDE: Java vs. groovy with eclipse.	ICPC	2014	["Pujan Petersen", "Stefan Hanenberg", "Romain Robbes"]
What is the foundation of evidence of human factors decisions in language design? an empirical study on programming language workshops.	ICPC	2014	["Andreas Stefik", "Stefan Hanenberg", "Mark McKenney", "Anneliese Amschler Andrews", "Srinivas Kalyan Yellanki", "Susanna Siebert"]
Domain matters: bringing further evidence of the relationships among anti-patterns, application domains, and quality-related metrics in Java mobile apps.	ICPC	2014	["Mario Linares V\u00e1squez", "Sam Klock", "Collin McMillan", "Aminata Sabane", "Denys Poshyvanyk", "Yann-Ga\u00ebl Gu\u00e9h\u00e9neuc"]
SCQAM: a scalable structured code quality assessment method for industrial software.	ICPC	2014	["Shrinath Gupta", "Himanshu Kumar Singh", "Radhika D. Venkatasubramanyam", "Umesh Uppili"]
Repeatedly-executed-method viewer for efficient visualization of execution paths and states in Java.	ICPC	2014	["Toshinori Matsumura", "Takashi Ishio", "Yu Kashima", "Katsuro Inoue"]
A formal evaluation of DepDegree based on weyuker's properties.	ICPC	2014	["Dirk Beyer", "Peter H\u00e4ring"]
Hey! are you committing tangled changes?	ICPC	2014	["Hiroyuki Kirinuki", "Yoshiki Higo", "Keisuke Hotta", "Shinji Kusumoto"]
A semiautomated method for classifying program analysis rules into a quality model.	ICPC	2014	["Shrinath Gupta", "Himanshu Kumar Singh"]
An approach for evaluating and suggesting method names using n-gram models.	ICPC	2014	["Takayuki Suzuki", "Kazunori Sakamoto", "Fuyuki Ishikawa", "Shinichi Honiden"]
Cross-language bug localization.	ICPC	2014	["Xin Xia", "David Lo", "Xingen Wang", "Chenyi Zhang", "Xinyu Wang"]
Automatic documentation generation via source code summarization of method context.	ICPC	2014	["Paul W. McBurney", "Collin McMillan"]
Improving topic model source code summarization.	ICPC	2014	["Paul W. McBurney", "Cheng Liu", "Collin McMillan", "Tim Weninger"]
A code obfuscation framework using code clones.	ICPC	2014	["Aniket Kulkarni", "Ravindra Metta"]
JCSD: visual support for understanding code control structure.	ICPC	2014	["Ahmad Jbara", "Dror G. Feitelson"]
Plagiarism detection for multithreaded software based on thread-aware software birthmarks.	ICPC	2014	["Zhenzhou Tian", "Qinghua Zheng", "Ting Liu", "Ming Fan", "Xiaodong Zhang", "Zijiang Yang"]
Redacting sensitive information in software artifacts.	ICPC	2014	["Mark Grechanik", "Collin McMillan", "Tathagata Dasgupta", "Denys Poshyvanyk", "Malcom Gethers"]
22nd International Conference on Program Comprehension, ICPC 2014, Hyderabad, India, June 2-3, 2014.		2014	["Chanchal K. Roy", "Andrew Begel", "Leon Moonen"]
Improving program comprehension by answering questions (keynote).	ICPC	2013	["Brad A. Myers"]
Part-of-speech tagging of program identifiers for improved text-based software engineering tools.	ICPC	2013	["Samir Gupta", "Sana Malik", "Lori L. Pollock", "K. Vijay-Shanker"]
Evaluating source code summarization techniques: Replication and expansion.	ICPC	2013	["Brian P. Eddy", "Jeffrey A. Robinson", "Nicholas A. Kraft", "Jeffrey C. Carver"]
Automatic generation of natural language summaries for Java classes.	ICPC	2013	["Laura Moreno", "Jairo Aponte", "Giriprasad Sridhara", "Andrian Marcus", "Lori L. Pollock", "K. Vijay-Shanker"]
An empirical study on the efficiency of graphical vs. textual representations in requirements comprehension.	ICPC	2013	["Zohreh Sharafi", "Alessandro Marchetto", "Angelo Susi", "Giuliano Antoniol", "Yann-Ga\u00ebl Gu\u00e9h\u00e9neuc"]
SArF map: Visualizing software architecture from feature and layer viewpoints.	ICPC	2013	["Kenichi Kobayashi", "Manabu Kamimura", "Keisuke Yano", "Koki Kato", "Akihiko Matsuo"]
Multiscale visual comparison of execution traces.	ICPC	2013	["Jonas Tr\u00fcmper", "J\u00fcrgen D\u00f6llner", "Alexandru Telea"]
In situ understanding of performance bottlenecks through visually augmented code.	ICPC	2013	["Fabian Beck", "Oliver Moseler", "Stephan Diehl", "G\u00fcnter Daniel Rey"]
Monitoring user interactions for supporting failure reproduction.	ICPC	2013	["Tobias Roehm", "Nigar Gurbanova", "Bernd Bruegge", "Christophe Joubert", "Walid Maalej"]
Quality analysis of source code comments.	ICPC	2013	["Daniela Steidl", "Benjamin Hummel", "Elmar J\u00fcrgens"]
Gapped code clone detection with lightweight source code analysis.	ICPC	2013	["Hiroaki Murakami", "Keisuke Hotta", "Yoshiki Higo", "Hiroshi Igaki", "Shinji Kusumoto"]
Insight into a method co-change pattern to identify highly coupled methods: An empirical study.	ICPC	2013	["Manishankar Mondal", "Chanchal K. Roy", "Kevin A. Schneider"]
Patterns of cross-language linking in java frameworks.	ICPC	2013	["Philip Mayer", "Andreas Schroeder"]
Using code ownership to improve IR-based Traceability Link Recovery.	ICPC	2013	["Diana Diaz", "Gabriele Bavota", "Andrian Marcus", "Rocco Oliveto", "Silvia Takahashi", "Andrea De Lucia"]
Structural information based term weighting in text retrieval for feature location.	ICPC	2013	["Blake Bassett", "Nicholas A. Kraft"]
Extracting problematic API features from forum discussions.	ICPC	2013	["Yingying Zhang", "Daqing Hou"]
Multi-dimensional exploration of API usage.	ICPC	2013	["Coen De Roover", "Ralf L\u00e4mmel", "Ekaterina Pek"]
Evaluating software clustering algorithms in the context of program comprehension.	ICPC	2013	["Anas Mahmoud", "Nan Niu"]
On the accuracy of Architecture Compliance Checking support Accuracy of dependency analysis and violation reporting.	ICPC	2013	["Leo Pruijt", "Christian K\u00f6ppe", "Sjaak Brinkkemper"]
Building extensions for applications: Towards the understanding of extension possibilities.	ICPC	2013	["Mohamed Aly", "Anis Charfi", "Mira Mezini"]
On the understanding of programs with continuous code reviews.	ICPC	2013	["Mario Bernhart", "Thomas Grechenig"]
Applying clone change notification system into an industrial development process.	ICPC	2013	["Yuki Yamanaka", "Eunjong Choi", "Norihiro Yoshida", "Katsuro Inoue", "Tateki Sano"]
Manhattan: Supporting real-time visual team activity awareness.	ICPC	2013	["Michele Lanza", "Marco D'Ambros", "Alberto Bacchelli", "Lile Hattori", "Francesco Rigotti"]
Blogging developer knowledge: Motivations, challenges, and future directions.	ICPC	2013	["Chris Parnin", "Christoph Treude", "Margaret-Anne D. Storey"]
Towards generating human-oriented summaries of unit test cases.	ICPC	2013	["Manabu Kamimura", "Gail C. Murphy"]
Towards a unified software attack model to assess software protections.	ICPC	2013	["Cataldo Basile", "Mariano Ceccato"]
Improving the detection accuracy of evolutionary coupling.	ICPC	2013	["Manishankar Mondal", "Chanchal K. Roy", "Kevin A. Schneider"]
Agec: An execution-semantic clone detection tool.	ICPC	2013	["Toshihiro Kamiya"]
JSummarizer: An automatic generator of natural language summaries for Java classes.	ICPC	2013	["Laura Moreno", "Andrian Marcus", "Lori L. Pollock", "K. Vijay-Shanker"]
OnionUML: An Eclipse plug-in for visualizing UML class diagrams in onion graph notation.	ICPC	2013	["Michael Falcone", "Bonita Sharif"]
SimCad: An extensible and faster clone detection tool for large scale software systems.	ICPC	2013	["Md. Sharif Uddin", "Chanchal K. Roy", "Kevin A. Schneider"]
IEEE 21st International Conference on Program Comprehension, ICPC 2013, San Francisco, CA, USA, 20-21 May, 2013.		2013	[]
Agile software assessment (Invited paper).	ICPC	2012	["Oscar Nierstrasz", "Mircea Lungu"]
Studying developers for fun and profit: (Keynote abstract).	ICPC	2012	["Robert DeLine"]
A retrospective view on: The role of concepts in program comprehension: (MIP award).	ICPC	2012	["Vaclav Rajlich", "Norman Wilde"]
Program complexity metrics and programmer opinions.	ICPC	2012	["Bernhard Katzmarski", "Rainer Koschke"]
Women and men - Different but equal: On the impact of identifier style on source code reading.	ICPC	2012	["Zohreh Sharafi", "Z\u00e9phyrin Soh", "Yann-Ga\u00ebl Gu\u00e9h\u00e9neuc", "Giuliano Antoniol"]
A lightweight visualization of interprocedural data-flow paths for source code reading.	ICPC	2012	["Takashi Ishio", "Shogo Etsuda", "Katsuro Inoue"]
Is the derivation of a model easier to understand than the model itself?	ICPC	2012	["Janet Feigenspan", "Don S. Batory", "Taylor L. Rich\u00e9"]
Evaluating forum discussions to inform the design of an API critic.	ICPC	2012	["Chandan Raj Rupakheti", "Daqing Hou"]
Mining source code descriptions from developer communications.	ICPC	2012	["Sebastiano Panichella", "Jairo Aponte", "Massimiliano Di Penta", "Andrian Marcus", "Gerardo Canfora"]
Measuring programming experience.	ICPC	2012	["Janet Feigenspan", "Christian K\u00e4stner", "J\u00f6rg Liebig", "Sven Apel", "Stefan Hanenberg"]
High-MCC functions in the Linux kernel.	ICPC	2012	["Ahmad Jbara", "Adam Matan", "Dror G. Feitelson"]
Understanding registration-based abstractions: A quantitative user study.	ICPC	2012	["John-Jose Nunez", "Gregor Kiczales"]
Concern-based cohesion: Unveiling a hidden dimension of cohesion measurement.	ICPC	2012	["Bruno Carreiro da Silva", "Cl\u00e1udio Sant'Anna", "Christina Chavez", "Alessandro Garcia"]
Understanding reuse in the Android Market.	ICPC	2012	["Israel J. Mojica Ruiz", "Meiyappan Nagappan", "Bram Adams", "Ahmed E. Hassan"]
Programmer information needs after memory failure.	ICPC	2012	["Chris Parnin", "Spencer Rugaber"]
Identifying computational phases from inter-process communication traces of HPC applications.	ICPC	2012	["Luay Alawneh", "Abdelwahab Hamou-Lhadj"]
Tracking and visualizing information flow in component-based systems.	ICPC	2012	["Amir Reza Yazdanshenas", "Leon Moonen"]
Do static type systems improve the maintainability of software systems? An empirical study.	ICPC	2012	["Sebastian Kleinschmager", "Stefan Hanenberg", "Romain Robbes", "\u00c9ric Tanter", "Andreas Stefik"]
Professional status and expertise for UML class diagram comprehension: An empirical study.	ICPC	2012	["Z\u00e9phyrin Soh", "Zohreh Sharafi", "Bertrand Van den Plas", "Gerardo Cepeda Porras", "Yann-Ga\u00ebl Gu\u00e9h\u00e9neuc", "Giuliano Antoniol"]
Modeling the ownership of source code topics.	ICPC	2012	["Christopher S. Corley", "Elizabeth A. Kammer", "Nicholas A. Kraft"]
A semantic relatedness approach for traceability link recovery.	ICPC	2012	["Anas Mahmoud", "Nan Niu", "Songhua Xu"]
Using IR methods for labeling source code artifacts: Is it worthwhile?	ICPC	2012	["Andrea De Lucia", "Massimiliano Di Penta", "Rocco Oliveto", "Annibale Panichella", "Sebastiano Panichella"]
A TraceLab-based solution for creating, conducting, and sharing feature location experiments.	ICPC	2012	["Bogdan Dit", "Evan Moritz", "Denys Poshyvanyk"]
Can clone detection support test comprehension?	ICPC	2012	["Benedikt Hauptmann", "Maximilian Junker", "Sebastian Eder", "Elmar J\u00fcrgens", "Rudolf Vaas"]
A controlled experiment on software clones.	ICPC	2012	["Jan Harder", "Rebecca Tiarks"]
Code querying by UML.	ICPC	2012	["Carlos Noguera", "Coen De Roover", "Andy Kellens", "Viviane Jonckers"]
CriticAL: A critic for APIs and libraries.	ICPC	2012	["Chandan Raj Rupakheti", "Daqing Hou"]
Supporting comprehension experiments with human subjects.	ICPC	2012	["Janet Feigenspan", "Norbert Siegmund"]
SeByte: A semantic clone detection tool for intermediate languages.	ICPC	2012	["Iman Keivanloo", "Chanchal K. Roy", "Juergen Rilling"]
CRat: A refactoring support tool for Form Template Method.	ICPC	2012	["Keisuke Hotta", "Yoshiki Higo", "Hiroshi Igaki", "Shinji Kusumoto"]
Toward structured location of features.	ICPC	2012	["Hiroshi Kazato", "Shinpei Hayashi", "Satoshi Okada", "Shunsuke Miyata", "Takashi Hoshino", "Motoshi Saeki"]
Extraction and improvement of conditionally compiled product line code.	ICPC	2012	["Bo Zhang"]
Applying bioinformatics in the analysis of software variants.	ICPC	2012	["Vasil L. Tenev", "Slawomir Duszynski"]
Parallel code clone detection using MapReduce.	ICPC	2012	["Hitesh Sajnani", "Joel Ossher", "Cristina Videira Lopes"]
Automatic software architecture recovery: A machine learning approach.	ICPC	2012	["Hitesh Sajnani"]
Toward an effective automated tracing process.	ICPC	2012	["Anas Mahmoud"]
Characterization of the Linux configuration system.	ICPC	2012	["Ahmad Jbara"]
Leveraging clone detection for Internet-scale source code search.	ICPC	2012	["Iman Keivanloo"]
IEEE 20th International Conference on Program Comprehension, ICPC 2012, Passau, Germany, June 11-13, 2012.		2012	["Dirk Beyer", "Arie van Deursen", "Michael W. Godfrey"]
Clustering Support for Static Concept Location in Source Code.	ICPC	2011	["Giuseppe Scanniello", "Andrian Marcus"]
Can Better Identifier Splitting Techniques Help Feature Location?	ICPC	2011	["Bogdan Dit", "Latifa Guerrouj", "Denys Poshyvanyk", "Giuliano Antoniol"]
Improving IR-based Traceability Recovery Using Smoothing Filters.	ICPC	2011	["Andrea De Lucia", "Massimiliano Di Penta", "Rocco Oliveto", "Annibale Panichella", "Sebastiano Panichella"]
The Influence of the Task on Programmer Behaviour.	ICPC	2011	["Annie T. T. Ying", "Martin P. Robillard"]
Precise and Scalable Querying of Syntactical Source Code Patterns Using Sample Code Snippets and a Database.	ICPC	2011	["Oleksandr Panchenko", "Jan Karstens", "Hasso Plattner", "Alexander Zeier"]
Is Aspect-Oriented Programming a Rewarding Investment into Future Code Changes? A Socio-technical Study on Development and Maintenance Time.	ICPC	2011	["Stefan Endrikat", "Stefan Hanenberg"]
SmartGroups: Focusing on Task-Relevant Source Artifacts in IDEs.	ICPC	2011	["David R\u00f6thlisberger", "Oscar Nierstrasz", "St\u00e9phane Ducasse"]
Generating Parameter Comments and Integrating with Method Summaries.	ICPC	2011	["Giriprasad Sridhara", "Lori L. Pollock", "K. Vijay-Shanker"]
Design Defects Detection and Correction by Example.	ICPC	2011	["Marouane Kessentini", "Wael Kessentini", "Houari A. Sahraoui", "Mounir Boukadoum", "Ali Ouni"]
Obstacles in Using Frameworks and APIs: An Exploratory Study of Programmers' Newsgroup Discussions.	ICPC	2011	["Daqing Hou", "Lin Li"]
Collective Code Bookmarks for Program Comprehension.	ICPC	2011	["Anja Guzzi", "Lile Hattori", "Michele Lanza", "Martin Pinzger", "Arie van Deursen"]
Trust-Based Requirements Traceability.	ICPC	2011	["Nasir Ali", "Yann-Ga\u00ebl Gu\u00e9h\u00e9neuc", "Giuliano Antoniol"]
AspectMaps: A Scalable Visualization of Join Point Shadows.	ICPC	2011	["Johan Fabry", "Andy Kellens", "St\u00e9phane Ducasse"]
Reasoning about Faults in Aspect-Oriented Programs: A Metrics-Based Evaluation.	ICPC	2011	["Rachel Burrows", "Fran\u00e7ois Ta\u00efani", "Alessandro Garcia", "Fabiano Cutigi Ferrari"]
Comparison of a Visual and a Textual Notation to Express Data Constraints in Aspect-Oriented Join Point Selections: A Controlled Experiment.	ICPC	2011	["Dominik Stein", "Stefan Hanenberg"]
Exploring Large-Scale System Similarity Using Incremental Clone Detection and Live Scatterplots.	ICPC	2011	["James R. Cordy"]
Software Evolution Comprehension: Replay to the Rescue.	ICPC	2011	["Lile Hattori", "Marco D'Ambros", "Michele Lanza", "Mircea Lungu"]
Feature Profiling for Evolving Systems.	ICPC	2011	["Elmar J\u00fcrgens", "Martin Feilkas", "Markus Herrmannsdoerfer", "Florian Deissenboeck", "Rudolf Vaas", "Karl-Heinz Prommer"]
MTF: A Scalable Exchange Format for Traces of High Performance Computing Systems.	ICPC	2011	["Luay Alawneh", "Abdelwahab Hamou-Lhadj"]
A Lightweight Approach to Uncover Technical Artifacts in Unstructured Data.	ICPC	2011	["Nicolas Bettenburg", "Bram Adams", "Ahmed E. Hassan", "Michel Smidt"]
On Visualization and Comprehension of Scenario-Based Programs.	ICPC	2011	["Nir Eitan", "Michal Gordon", "David Harel", "Assaf Marron", "Gera Weiss"]
Faceted Navigation for Software Exploration.	ICPC	2011	["Nan Niu", "Anas Mahmoud", "Xiaoyong Yang"]
Subvocalization - Toward Hearing the Inner Thoughts of Developers.	ICPC	2011	["Chris Parnin"]
