Title	Venue	Year	Authors
Use of a Genetic Algorithm to Identify Source Code Metrics Which Improves Cognitive Complexity Predictive Models.	ICPC	2007	["Rodrigo A. Vivanco"]
15th International Conference on Program Comprehension (ICPC 2007), June 26-29, 2007, Banff, Alberta, Canada.		2007	[]
Evolving a Legacy Application Portfolio at Sallie Mae: Program Comprehension and Beyond.	ICPC	2006	["Robert S. Autor"]
What's in a Name? A Study of Identifiers.	ICPC	2006	["Dawn Lawrie", "Christopher Morrell", "Henry Feild", "David Binkley"]
Building Usage Contexts During Program Comprehension.	ICPC	2006	["Chris Parnin", "Carsten G\u00f6rg"]
Digging the Development Dust for Refactorings.	ICPC	2006	["Curtis Schofield", "Brendan Tansey", "Zhenchang Xing", "Eleni Stroulia"]
Classifying Change Types for Qualifying Change Couplings.	ICPC	2006	["Beat Fluri", "Harald C. Gall"]
Studying the Evolution of Software Systems Using Change Clusters.	ICPC	2006	["Jay Kothari", "Ali Shokoufandeh", "Spiros Mancoridis", "Ahmed E. Hassan"]
How Developers Copy.	ICPC	2006	["Mihai Balint", "Radu Marinescu", "Tudor G\u00eerba"]
Combining Probabilistic Ranking and Latent Semantic Indexing for Feature Identification.	ICPC	2006	["Denys Poshyvanyk", "Andrian Marcus", "V\u00e1clav Rajlich", "Yann-Ga\u00ebl Gu\u00e9h\u00e9neuc", "Giuliano Antoniol"]
Program Redocumentation: Lessons Learned & Future Challenges.	ICPC	2006	["Scott R. Tilley"]
A Synergistic Approach to Program Comprehension.	ICPC	2006	["Bradley L. Vinz", "Letha H. Etzkorn"]
How Webmining and Coupling Metrics Improve Early Program Comprehension.	ICPC	2006	["Andy Zaidman", "Bart Du Bois", "Serge Demeyer"]
Programs are Knowledge Bases.	ICPC	2006	["Daniel Ratiu", "Florian Deissenboeck"]
Dynamic Analysis of Software Systems using Execution Pattern Mining.	ICPC	2006	["Hossein Safyallah", "Kamran Sartipi"]
Layered Program Auralization: Using Music to Increase Runtime Program Comprehension and Debugging Effectiveness.	ICPC	2006	["Andreas Stefik", "Kelly Fitz", "Roger T. Alexander"]
Integrating Reverse Engineering Tools Using a Service-Sharing Methodology.	ICPC	2006	["Dean Jin", "James R. Cordy"]
An Architecture to Support Model Driven Software Visualization.	ICPC	2006	["R. Ian Bull", "Margaret-Anne D. Storey", "Jean-Marie Favre", "Marin Litoiu"]
Using Abstraction-driven Slicing for Postmortem Analysis of Software.	ICPC	2006	["Raoul Praful Jetley", "Yi Zhang", "S. Purushothaman Iyer"]
Automated Extraction of Database Interactions in Web Applications.	ICPC	2006	["Minh Ngoc Ngo", "Hee Beng Kuan Tan", "Doanh Trinh"]
An Approach for Extracting Workflows from E-Commerce Applications.	ICPC	2006	["Ying Zou", "Maokeng Hung"]
Leveraged Quality Assessment using Information Retrieval Techniques.	ICPC	2006	["Dawn J. Lawrie", "Henry Feild", "David Binkley"]
A Metric-Based Heuristic Framework to Detect Object-Oriented Design Flaws.	ICPC	2006	["Mazeiar Salehie", "Shimin Li", "Ladan Tahvildari"]
Identification of Design Roles for the Assessment of Design Quality in Enterprise Applications.	ICPC	2006	["Cristina Marinescu"]
Summarizing the Content of Large Traces to Facilitate the Understanding of the Behaviour of a Software System.	ICPC	2006	["Abdelwahab Hamou-Lhadj", "Timothy Lethbridge"]
Dynamic Data Structure Analysis for Java Programs.	ICPC	2006	["Sokhom Pheng", "Clark Verbrugge"]
An Approach to High-Level Behavioral Program Documentation Allowing Lightweight Verification.	ICPC	2006	["Coen De Roover", "Isabel Michiels", "Kim Gybels", "Kris Gybels", "Theo D'Hondt"]
Profile-Based Approach to Support Comprehension of Software Behavior.	ICPC	2006	["Johannes Koskinen", "Markus Kettunen", "Tarja Syst\u00e4"]
The Sound of Software: Using Sonification to Aid Comprehension.	ICPC	2006	["Lewis I. Berman", "Sebastian Danicic", "Keith Brian Gallagher", "Nicolas Gold"]
Experimental Settings in Program Comprehension: Challenges and Open Issues.	ICPC	2006	["Giuseppe A. Di Lucca", "Massimiliano Di Penta"]
Working Session: Program Comprehension and Migration Strategies for Web Service and Service-Oriented Architectures.	ICPC	2006	["Dennis B. Smith", "Liam O'Brien", "Kostas Kontogiannis"]
The Cognitive Assignment Eclipse Plug-in.	ICPC	2006	["Brendan Cleary", "Chris Exton"]
INFORM: A Framework for Performance Informed Software Development.	ICPC	2006	["Aiden Grandfield", "Chris Exton"]
Evolution Storyboards: Visualization of Software Structure Dynamics.	ICPC	2006	["Dirk Beyer", "Ahmed E. Hassan"]
JIRiSS - an Eclipse plug-in for Source Code Exploration.	ICPC	2006	["Denys Poshyvanyk", "Andrian Marcus", "Yubo Dong"]
Alborz: An Interactive Toolkit to Extract Static and Dynamic Views of a Software System.	ICPC	2006	["Kamran Sartipi", "Lingdong Ye", "Hossein Safyallah"]
Fluid Source Code Views.	ICPC	2006	["Michael Desmond", "Margaret-Anne D. Storey", "Chris Exton"]
JComp: A Reuse-Driven Componentization Framework for Java Applications.	ICPC	2006	["Shimin Li", "Ladan Tahvildari"]
Understanding Obfuscated Code.	ICPC	2006	["Matias Madou", "Ludo Van Put", "Koen De Bosschere"]
A Context-Aware Analysis Scheme for Bloom's Taxonomy.	ICPC	2006	["Tara Kelly", "Jim Buckley"]
Towards a Client Driven Characterization of Class Hierarchies.	ICPC	2006	["Petru Florin Mihancea"]
Reverse Engineering Scripting Language Extensions.	ICPC	2006	["Daniel L. Moise", "Kenny Wong", "H. James Hoover", "Daqing Hou"]
Can Information Retrieval Techniques Effectively Support Traceability Link Recovery?	ICPC	2006	["Andrea De Lucia", "Fausto Fasano", "Rocco Oliveto", "Genoveffa Tortora"]
Improving Comprehensibility of Source Code via Traceability Information: a Controlled Experiment.	ICPC	2006	["Andrea De Lucia", "Rocco Oliveto", "Francesco Zurolo", "Massimiliano Di Penta"]
Programmer-friendly Decompiled Java.	ICPC	2006	["Nomair A. Naeem", "Laurie J. Hendren"]
14th International Conference on Program Comprehension (ICPC 2006), 14-16 June 2006, Athens, Greece.		2006	[]
